url,title,price,description,stock,tags,categories,sku,poids,longueur,largeur,hauteur
https://scrapeme.live/shop/Palpitoad/,Palpitoad,"£,117.00","It lives in the water and on land. It uses its long, sticky tongue to immobilize its opponents.",36 in stock,"Hydration,palpitoad,Vibration","Pokemon,Vibration",8017,37.5 kg,2,2,2
https://scrapeme.live/shop/Conkeldurr/,Conkeldurr,"£,72.00","Rather than rely on force, they master moves that utilize the centrifugal force of spinning concrete.",251 in stock,"conkeldurr,Guts,Muscular","Muscular,Pokemon",3386,191.8 kg,4,4,4
https://scrapeme.live/shop/Gurdurr/,Gurdurr,"£,179.00",This Pokémon is so muscular and strongly built that even a group of wrestlers could not make it budge an inch.,105 in stock,"gurdurr,Guts,Muscular","Muscular,Pokemon",8012,88.2 kg,3,3,3
https://scrapeme.live/shop/Timburr/,Timburr,"£,194.00","Always carrying squared logs, they help out with construction. As they grow, they carry bigger logs.",150 in stock,"Guts,Muscular,timburr","Muscular,Pokemon",2178,27.6 kg,2,2,2
https://scrapeme.live/shop/Audino/,Audino,"£,95.00","It touches others with the feelers on its ears, using the sound of their heartbeats to tell how they are feeling.",109 in stock,"audino,Healer,Hearing","Hearing,Pokemon",5659,68.3 kg,3,3,3
https://scrapeme.live/shop/Carracosta/,Carracosta,"£,158.00","It could knock out a foe with a slap from one of its developed front appendages and chew it up, shell or bones and all.",11 in stock,"carracosta,Prototurtle,Sturdy","Pokemon,Prototurtle",9806,178.6 kg,3,3,3
https://scrapeme.live/shop/Tirtouga/,Tirtouga,"£,60.00","Restored from a fossil, this Pokémon can dive to depths beyond half a mile.",98 in stock,"Prototurtle,Sturdy,tirtouga","Pokemon,Prototurtle",2653,36.4 kg,2,2,2
https://scrapeme.live/shop/Cofagrigus/,Cofagrigus,"£,160.00",Grave robbers who mistake them for real coffins and get too close end up trapped inside their bodies.,195 in stock,"cofagrigus,Coffin,Mummy","Coffin,Pokemon",3040,168.7 kg,5,5,5
https://scrapeme.live/shop/Yamask/,Yamask,"£,171.00",Each of them carries a mask that used to be its face when it was human. Sometimes they look at it and cry.,168 in stock,"Mummy,Spirit,yamask","Pokemon,Spirit",4675,3.3 kg,1,1,1
https://scrapeme.live/shop/Sigilyph/,Sigilyph,"£,68.00","The guardians of an ancient city, they always fly the same route while keeping watch for invaders.",181 in stock,"Avianoid,Magic Guard,sigilyph","Avianoid,Pokemon",3922,30.9 kg,4,4,4
https://scrapeme.live/shop/Scrafty/,Scrafty,"£,137.00",It can smash concrete blocks with its kicking attacks. The one with the biggest crest is the group leader.,152 in stock,"Hoodlum,scrafty,Shed Skin","Hoodlum,Pokemon",2230,66.1 kg,3,3,3
https://scrapeme.live/shop/Scraggy/,Scraggy,"£,112.00","Proud of its sturdy skull, it suddenly headbutts everything, but its weight makes it unstable, too.",95 in stock,"scraggy,Shed Skin,Shedding","Pokemon,Shedding",6618,26 kg,2,2,2
https://scrapeme.live/shop/Crustle/,Crustle,"£,105.00","Competing for territory, Crustle fight viciously. The one whose boulder is broken is the loser of the battle.",293 in stock,"crustle,Stone Home,Sturdy","Pokemon,Stone Home",5980,440.9 kg,4,4,4
https://scrapeme.live/shop/Dwebble/,Dwebble,"£,75.00","When it finds a stone of a suitable size, it secretes a liquid from its mouth to open up a hole to crawl into.",47 in stock,"dwebble,Rock Inn,Sturdy","Pokemon,Rock Inn",2996,32 kg,1,1,1
https://scrapeme.live/shop/Maractus/,Maractus,"£,31.00","Arid regions are their habitat. They move rhythmically, making a sound similar to maracas.",120 in stock,"Cactus,Chlorophyll,maractus","Cactus,Pokemon",8956,61.7 kg,3,3,3
https://scrapeme.live/shop/Darumaka/,Darumaka,"£,106.00","When it sleeps, it pulls its limbs into its body and its internal fire goes down to 1,100 degrees Fahrenheit.",96 in stock,"darumaka,Hustle,Zen Charm","Pokemon,Zen Charm",2580,82.7 kg,2,2,2
https://scrapeme.live/shop/Krookodile/,Krookodile,"£,185.00","They never allow prey to escape. Their jaws are so powerful, they can crush the body of an automobile.",188 in stock,"Intimidate,Intimidation,krookodile","Intimidation,Pokemon",2595,212.3 kg,4,4,4
https://scrapeme.live/shop/Krokorok/,Krokorok,"£,135.00","The special membrane covering its eyes can sense the heat of objects, so it can see its surroundings even in darkness.",168 in stock,"Desert Croc,Intimidate,krokorok","Desert Croc,Pokemon",3317,73.6 kg,3,3,3
https://scrapeme.live/shop/Sandile/,Sandile,"£,136.00",They live buried in the sands of the desert. The sun-warmed sands prevent their body temperature from dropping.,235 in stock,"Desert Croc,Intimidate,sandile","Desert Croc,Pokemon",8011,33.5 kg,2,2,2
https://scrapeme.live/shop/Lilligant/,Lilligant,"£,137.00",Even veteran Trainers face a challenge in getting its beautiful flower to bloom. This Pokémon is popular with celebrities.,209 in stock,"Chlorophyll,Flowering,lilligant","Flowering,Pokemon",4452,35.9 kg,3,3,3
https://scrapeme.live/shop/Petilil/,Petilil,"£,118.00","Since they prefer moist, nutrient-rich soil, the areas where Petilil live are known to be good for growing plants.",109 in stock,"Bulb,Chlorophyll,petilil","Bulb,Pokemon",3773,14.6 kg,1,1,1
https://scrapeme.live/shop/Vanillite/,Vanillite,"£,108.00",This Pokémon formed from icicles bathed in energy from the morning sun. It sleeps buried in snow.,284 in stock,"Fresh Snow,Ice Body,vanillite","Fresh Snow,Pokemon",1774,12.6 kg,1,1,1
https://scrapeme.live/shop/Swanna/,Swanna,"£,36.00",Swanna start to dance at dusk. The one dancing in the middle is the leader of the flock.,238 in stock,"Keen Eye,swanna,White Bird","Pokemon,White Bird",5069,53.4 kg,4,4,4
https://scrapeme.live/shop/Ducklett/,Ducklett,"£,159.00","They are better at swimming than flying, and they happily eat their favorite food, peat moss, as they dive underwater.",275 in stock,"ducklett,Keen Eye,Water Bird","Pokemon,Water Bird",4228,12.1 kg,1,1,1
https://scrapeme.live/shop/Reuniclus/,Reuniclus,"£,168.00","When Reuniclus shake hands, a network forms between their brains, increasing their psychic power.",193 in stock,"Magic Guard,Multiplying,reuniclus","Multiplying,Pokemon",1792,44.3 kg,3,3,3
https://scrapeme.live/shop/Duosion/,Duosion,"£,71.00","When their two divided brains think the same thoughts, their psychic power is maximized.",183 in stock,"duosion,Magic Guard,Mitosis","Mitosis,Pokemon",2453,17.6 kg,2,2,2
https://scrapeme.live/shop/Solosis/,Solosis,"£,134.00",They drive away attackers by unleashing psychic power. They can use telepathy to talk with others.,226 in stock,"Cell,Magic Guard,solosis","Cell,Pokemon",7460,2.2 kg,1,1,1
https://scrapeme.live/shop/Gothitelle/,Gothitelle,"£,164.00",They can predict the future from the placement and movement of the stars. They can see Trainers’ life spans.,52 in stock,"Astral Body,Frisk,gothitelle","Astral Body,Pokemon",1473,97 kg,4,4,4
https://scrapeme.live/shop/Gothorita/,Gothorita,"£,189.00","According to many old tales, it creates friends for itself by controlling sleeping children on starry nights.",148 in stock,"Frisk,gothorita,Manipulate","Manipulate,Pokemon",5260,39.7 kg,2,2,2
https://scrapeme.live/shop/Gothita/,Gothita,"£,68.00","They intently observe both Trainers and Pokémon. Apparently, they are looking at something that only Gothita can see.",185 in stock,"Fixation,Frisk,gothita","Fixation,Pokemon",7024,12.8 kg,1,1,1
https://scrapeme.live/shop/Cinccino/,Cinccino,"£,154.00","Cinccino’s body is coated in a special oil that helps it deflect attacks, such as punches.",159 in stock,"cinccino,Cute Charm,Scarf","Pokemon,Scarf",3396,16.5 kg,1,1,1
https://scrapeme.live/shop/Minccino/,Minccino,"£,79.00","These Pokémon prefer a tidy habitat. They are always sweeping and dusting, using their tails as brooms.",213 in stock,"Chinchilla,Cute Charm,minccino","Chinchilla,Pokemon",9722,12.8 kg,1,1,1
https://scrapeme.live/shop/Zorua/,Zorua,"£,81.00","To protect themselves from danger, they hide their true identities by transforming into people and Pokémon.",245 in stock,"Illusion,Tricky Fox,zorua","Pokemon,Tricky Fox",6103,27.6 kg,2,2,2
https://scrapeme.live/shop/Garbodor/,Garbodor,"£,178.00",Consuming garbage makes new kinds of poison gases and liquids inside their bodies.,73 in stock,"garbodor,Stench,Trash Heap","Pokemon,Trash Heap",6031,236.6 kg,6,6,6
https://scrapeme.live/shop/Trubbish/,Trubbish,"£,169.00",Inhaling the gas they belch will make you sleep for a week. They prefer unsanitary places.,229 in stock,"Stench,Trash Bag,trubbish","Pokemon,Trash Bag",3015,68.3 kg,2,2,2
https://scrapeme.live/shop/Archeops/,Archeops,"£,126.00",It runs better than it flies. It takes off into the sky by running at a speed of 25 mph.,181 in stock,"archeops,Defeatist,First Bird","First Bird,Pokemon",1822,70.5 kg,4,4,4
https://scrapeme.live/shop/Archen/,Archen,"£,140.00","Said to be an ancestor of bird Pokémon, they were unable to fly and moved about by hopping from one branch to another.",267 in stock,"archen,Defeatist,First Bird","First Bird,Pokemon",4705,20.9 kg,1,1,1
https://scrapeme.live/shop/Klang/,Klang,"£,162.00","A minigear and big gear comprise its body. If the minigear it launches at a foe doesn’t return, it will die.",114 in stock,"Gear,klang,Plus","Gear,Pokemon",9991,112.4 kg,2,2,2
https://scrapeme.live/shop/Klink/,Klink,"£,75.00",The two minigears that mesh together are predetermined. Each will rebound from other minigears without meshing.,84 in stock,"Gear,klink,Plus","Gear,Pokemon",5294,46.3 kg,1,1,1
https://scrapeme.live/shop/Ferrothorn/,Ferrothorn,"£,182.00","They attach themselves to cave ceilings, firing steel spikes at targets passing beneath them.",74 in stock,"ferrothorn,Iron Barbs,Thorn Pod","Pokemon,Thorn Pod",5533,242.5 kg,3,3,3
https://scrapeme.live/shop/Ferroseed/,Ferroseed,"£,81.00",It absorbs the iron it finds in the rock while clinging to the ceiling. It shoots spikes when in danger.,149 in stock,"ferroseed,Iron Barbs,Thorn Seed","Pokemon,Thorn Seed",5368,41.4 kg,2,2,2
https://scrapeme.live/shop/Galvantula/,Galvantula,"£,57.00","When attacked, they create an electric barrier by spitting out many electrically charged threads.",61 in stock,"Compound Eyes,EleSpider,galvantula","EleSpider,Pokemon",4595,31.5 kg,2,2,2
https://scrapeme.live/shop/Joltik/,Joltik,"£,59.00","They attach themselves to large-bodied Pokémon and absorb static electricity, which they store in an electric pouch.",137 in stock,"Attaching,Compound Eyes,joltik","Attaching,Pokemon",4385,1.3 kg,,,
https://scrapeme.live/shop/Alomomola/,Alomomola,"£,35.00",It gently holds injured and weak Pokémon in its fins. Its special membrane heals their wounds.,296 in stock,"alomomola,Caring,Hydration","Caring,Pokemon",8864,69.7 kg,3,3,3
https://scrapeme.live/shop/Jellicent/,Jellicent,"£,114.00","The fate of the ships and crew that wander into Jellicent’s habitat: all sunken, all lost, all vanished.",216 in stock,"Floating,jellicent,Water Absorb","Floating,Pokemon",2412,297.6 kg,7,7,7
https://scrapeme.live/shop/Frillish/,Frillish,"£,63.00","If its veil-like arms stun and wrap a foe, that foe will be dragged miles below the surface, never to return.",32 in stock,"Floating,frillish,Water Absorb","Floating,Pokemon",5310,72.8 kg,3,3,3
https://scrapeme.live/shop/Foongus/,Foongus,"£,129.00","It lures Pokémon with its pattern that looks just like a Poké Ball, then releases poison spores.",225 in stock,"Effect Spore,foongus,Mushroom","Mushroom,Pokemon",7154,2.2 kg,,,
https://scrapeme.live/shop/Escavalier/,Escavalier,"£,189.00",These Pokémon evolve by wearing the shell covering of a Shelmet. The steel armor protects their whole body.,281 in stock,"Cavalry,escavalier,Swarm","Cavalry,Pokemon",1906,72.8 kg,3,3,3
https://scrapeme.live/shop/Karrablast/,Karrablast,"£,41.00",For some reason they evolve when they receive electrical energy while they are attacking Shelmet.,296 in stock,"Clamping,karrablast,Shed Skin","Clamping,Pokemon",9391,13 kg,1,1,1
https://scrapeme.live/shop/Sawsbuck/,Sawsbuck,"£,76.00","They migrate according to the seasons, so some people call Sawsbuck the harbingers of spring.",299 in stock,"Chlorophyll,sawsbuck,Season","Pokemon,Season",6782,203.9 kg,6,6,6
https://scrapeme.live/shop/Deerling/,Deerling,"£,141.00",The turning of the seasons changes the color and scent of this Pokémon’s fur. People use it to mark the seasons.,159 in stock,"Chlorophyll,deerling,Season","Pokemon,Season",5837,43 kg,2,2,2
https://scrapeme.live/shop/Vanilluxe/,Vanilluxe,"£,89.00","Swallowing large amounts of water, they make snow clouds inside their bodies and, when angry, cause violent blizzards.",30 in stock,"Ice Body,Snowstorm,vanilluxe","Pokemon,Snowstorm",2362,126.8 kg,4,4,4
https://scrapeme.live/shop/Vanillish/,Vanillish,"£,93.00","Snowy mountains are this Pokémon’s habitat. During an ancient ice age, they moved to southern areas.",218 in stock,"Ice Body,Icy Snow,vanillish","Icy Snow,Pokemon",5776,90.4 kg,3,3,3
https://scrapeme.live/shop/Accelgor/,Accelgor,"£,129.00","When its body dries out, it weakens. So, to prevent dehydration, it wraps itself in many layers of thin membrane.",124 in stock,"accelgor,Hydration,Shell Out","Pokemon,Shell Out",7958,55.8 kg,2,2,2
https://scrapeme.live/shop/Shelmet/,Shelmet,"£,190.00",It evolves when bathed in an electric-like energy along with Karrablast. The reason is still unknown.,131 in stock,"Hydration,shelmet,Snail","Pokemon,Snail",8708,17 kg,1,1,1
https://scrapeme.live/shop/Cryogonal/,Cryogonal,"£,72.00","They are composed of ice crystals. They capture prey with chains of ice, freezing the prey at -148 degrees Fahrenheit.",203 in stock,"cryogonal,Crystallizing,Levitate","Crystallizing,Pokemon",5993,326.3 kg,3,3,3
https://scrapeme.live/shop/Beartic/,Beartic,"£,28.00",It freezes its breath to create fangs and claws of ice to fight with. Cold northern areas are its habitat.,272 in stock,"beartic,Freezing,Snow Cloak","Freezing,Pokemon",1322,573.2 kg,8,8,8
https://scrapeme.live/shop/Cubchoo/,Cubchoo,"£,62.00","Their snot is a barometer of health. When healthy, their snot is sticky and the power of their ice moves increases.",45 in stock,"Chill,cubchoo,Snow Cloak","Chill,Pokemon",3643,18.7 kg,1,1,1
https://scrapeme.live/shop/Haxorus/,Haxorus,"£,135.00",Their sturdy tusks will stay sharp even if used to cut steel beams. These Pokémon are covered in hard armor.,239 in stock,"Axe Jaw,haxorus,Rivalry","Axe Jaw,Pokemon",3951,232.6 kg,5,5,5
https://scrapeme.live/shop/Fraxure/,Fraxure,"£,64.00","A broken tusk will not grow back, so it diligently sharpens its tusks on river rocks after the end of a battle.",234 in stock,"Axe Jaw,fraxure,Rivalry","Axe Jaw,Pokemon",8993,79.4 kg,3,3,3
https://scrapeme.live/shop/Axew/,Axew,"£,123.00","They mark their territory by leaving gashes in trees with their tusks. If a tusk breaks, a new one grows in quickly.",142 in stock,"axew,Rivalry,Tusk","Pokemon,Tusk",9236,39.7 kg,2,2,2
https://scrapeme.live/shop/Lampent/,Lampent,"£,157.00",It arrives near the moment of death and steals spirit from the body.,48 in stock,"Flash Fire,Lamp,lampent","Lamp,Pokemon",6418,28.7 kg,2,2,2
https://scrapeme.live/shop/Litwick/,Litwick,"£,37.00","Litwick shines a light that absorbs the life energy of people and Pokémon, which becomes the fuel that it burns.",76 in stock,"Candle,Flash Fire,litwick","Candle,Pokemon",7933,6.8 kg,1,1,1
https://scrapeme.live/shop/Elgyem/,Elgyem,"£,107.00",Rumors of its origin are linked to a UFO crash site in the desert 50 years ago.,111 in stock,"Cerebral,elgyem,Synchronize","Cerebral,Pokemon",3449,19.8 kg,1,1,1
https://scrapeme.live/shop/Beheeyem/,Beheeyem,"£,34.00",It uses psychic power to control an opponent’s brain and tamper with its memories.,68 in stock,"beheeyem,Cerebral,Synchronize","Cerebral,Pokemon",7367,76.1 kg,3,3,3
https://scrapeme.live/shop/Eelektross/,Eelektross,"£,123.00",They crawl out of the ocean using their arms. They will attack prey on shore and immediately drag it into the ocean.,111 in stock,"eelektross,EleFish,Levitate","EleFish,Pokemon",2066,177.5 kg,6,6,6
https://scrapeme.live/shop/Eelektrik/,Eelektrik,"£,198.00","These Pokémon have a big appetite. When they spot their prey, they attack it and paralyze it with electricity.",150 in stock,"eelektrik,EleFish,Levitate","EleFish,Pokemon",5128,48.5 kg,3,3,3
https://scrapeme.live/shop/Tynamo/,Tynamo,"£,82.00","One alone can emit only a trickle of electricity, so a group of them gathers to unleash a powerful electric shock.",46 in stock,"EleFish,Levitate,tynamo","EleFish,Pokemon",7438,0.7 kg,,,
https://scrapeme.live/shop/Klinklang/,Klinklang,"£,178.00",Its red core functions as an energy tank. It fires the charged energy through its spikes into an area.,87 in stock,"Gear,klinklang,Plus","Gear,Pokemon",9489,178.6 kg,2,2,2
https://scrapeme.live/shop/Stunfisk/,Stunfisk,"£,67.00","It conceals itself in the mud of the seashore. Then it waits. When prey touch it, it delivers a jolt of electricity.",288 in stock,"Static,stunfisk,Trap","Pokemon,Trap",2448,24.3 kg,2,2,2
https://scrapeme.live/shop/Deino/,Deino,"£,63.00","Lacking sight, it’s unaware of its surroundings, so it bumps into things and eats anything that moves.",40 in stock,"deino,Hustle,Irate","Irate,Pokemon",8088,38.1 kg,2,2,2
https://scrapeme.live/shop/Durant/,Durant,"£,28.00","They attack in groups, covering themselves in steel armor to protect themselves from Heatmor.",272 in stock,"durant,Iron Ant,Swarm","Iron Ant,Pokemon",2490,72.8 kg,1,1,1
https://scrapeme.live/shop/Heatmor/,Heatmor,"£,81.00","It draws in air through its tail, transforms it into fire, and uses it like a tongue. It melts Durant and eats them.",299 in stock,"Anteater,Flash Fire,heatmor","Anteater,Pokemon",5965,127.9 kg,4,4,4
https://scrapeme.live/shop/Mandibuzz/,Mandibuzz,"£,89.00","Watching from the sky, they swoop to strike weakened Pokémon on the ground. They decorate themselves with bones.",296 in stock,"Big Pecks,Bone Vulture,mandibuzz","Bone Vulture,Pokemon",7635,87.1 kg,3,3,3
https://scrapeme.live/shop/Vullaby/,Vullaby,"£,61.00",Their wings are too tiny to allow them to fly. They guard their posteriors with bones that were gathered by Mandibuzz.,16 in stock,"Big Pecks,Diapered,vullaby","Diapered,Pokemon",8446,19.8 kg,1,1,1
https://scrapeme.live/shop/Braviary/,Braviary,"£,83.00",They fight for their friends without any thought about danger to themselves. One can carry a car while flying.,262 in stock,"braviary,Keen Eye,Valiant","Pokemon,Valiant",1770,90.4 kg,4,4,4
https://scrapeme.live/shop/Rufflet/,Rufflet,"£,60.00","They will challenge anything, even strong opponents, without fear. Their frequent fights help them become stronger.",194 in stock,"Eaglet,Keen Eye,rufflet","Eaglet,Pokemon",8587,23.1 kg,1,1,1
https://scrapeme.live/shop/Bouffalant/,Bouffalant,"£,59.00","Their fluffy fur absorbs damage, even if they strike foes with a fierce headbutt.",201 in stock,"Bash Buffalo,bouffalant,Reckless","Bash Buffalo,Pokemon",5666,208.6 kg,5,5,5
https://scrapeme.live/shop/Bisharp/,Bisharp,"£,129.00",Bisharp pursues prey in the company of a large group of Pawniard. Then Bisharp finishes off the prey.,255 in stock,"bisharp,Inner Focus,Sword Blade","Pokemon,Sword Blade",8828,154.3 kg,5,5,5
https://scrapeme.live/shop/Pawniard/,Pawniard,"£,37.00","Ignoring their injuries, groups attack by sinking the blades that cover their bodies into their prey.",58 in stock,"Inner Focus,pawniard,Sharp Blade","Pokemon,Sharp Blade",3172,22.5 kg,1,1,1
https://scrapeme.live/shop/Golurk/,Golurk,"£,74.00",It flies across the sky at Mach speeds. Removing the seal on its chest makes its internal energy go out of control.,133 in stock,"Automaton,golurk,Iron Fist","Automaton,Pokemon",5196,727.5 kg,9,9,9
https://scrapeme.live/shop/Golett/,Golett,"£,89.00",Ancient science fashioned this Pokémon from clay. It’s been active for thousands of years.,274 in stock,"Automaton,golett,Iron Fist","Automaton,Pokemon",8500,202.8 kg,3,3,3
https://scrapeme.live/shop/Druddigon/,Druddigon,"£,110.00","It warms its body by absorbing sunlight with its wings. When its body temperature falls, it can no longer move.",266 in stock,"Cave,druddigon,Rough Skin","Cave,Pokemon",4185,306.4 kg,5,5,5
https://scrapeme.live/shop/Mienshao/,Mienshao,"£,50.00","Using the long fur on its arms like whips, it launches into combo attacks that, once started, no one can stop.",253 in stock,"Inner Focus,Martial Arts,mienshao","Martial Arts,Pokemon",8121,78.3 kg,4,4,4
https://scrapeme.live/shop/Mienfoo/,Mienfoo,"£,197.00","In fights, they dominate with onslaughts of flowing, continuous attacks. With their sharp claws, they cut enemies.",82 in stock,"Inner Focus,Martial Arts,mienfoo","Martial Arts,Pokemon",2424,44.1 kg,2,2,2
https://scrapeme.live/shop/Spinarak/,Spinarak,"£,199.00",The web spun by Spinarak can be considered its second nervous system. It is said that this Pokémon can determine what kind of prey is touching its web just by the tiny vibrations it feels through the web’s strands.,136 in stock,"spinarak,String Spit,Swarm","Pokemon,String Spit",4388,18.7 kg,1,1,1
https://scrapeme.live/shop/Froakie/,Froakie,"£,38.00","It protects its skin by covering its body in delicate bubbles. Beneath its happy-go-lucky air, it keeps a watchful eye on its surroundings.",143 in stock,"Bubble Frog,froakie,Torrent","Bubble Frog,Pokemon",8475,15.4 kg,1,1,1
https://scrapeme.live/shop/Delphox/,Delphox,"£,170.00","Using psychic power, it generates a fiery vortex of 5,400 degrees Fahrenheit, incinerating foes swept into this whirl of flame.",146 in stock,"Blaze,delphox,Fox","Fox,Pokemon",3188,86 kg,4,4,4
https://scrapeme.live/shop/Braixen/,Braixen,"£,59.00","When the twig is plucked from its tail, friction sets the twig alight. The flame is used to send signals to its allies.",71 in stock,"Blaze,braixen,Fox","Fox,Pokemon",6617,32 kg,3,3,3
https://scrapeme.live/shop/Fennekin/,Fennekin,"£,123.00","As it walks, it munches on a twig in place of a snack. It intimidates opponents by puffing hot air out of its ears.",183 in stock,"Blaze,fennekin,Fox","Fox,Pokemon",1069,20.7 kg,1,1,1
https://scrapeme.live/shop/Chesnaught/,Chesnaught,"£,96.00","When it takes a defensive posture with its fists guarding its face, it could withstand a bomb blast.",145 in stock,"chesnaught,Overgrow,Spiny Armor","Pokemon,Spiny Armor",5360,198.4 kg,5,5,5
https://scrapeme.live/shop/Chespin/,Chespin,"£,185.00",Such a thick shell of wood covers its head and back that even a direct hit from a truck wouldn’t faze it.,267 in stock,"chespin,Overgrow,Spiny Nut","Pokemon,Spiny Nut",2048,19.8 kg,1,1,1
https://scrapeme.live/shop/Quilladin/,Quilladin,"£,161.00",They strengthen their lower bodies by running into one another. They are very kind and won’t start fights.,61 in stock,"Overgrow,quilladin,Spiny Armor","Pokemon,Spiny Armor",7500,63.9 kg,2,2,2
https://scrapeme.live/shop/Genesect/,Genesect,"£,173.00",This Pokémon existed 300 million years ago. Team Plasma altered it and attached a cannon to its back.,30 in stock,"Download,genesect,Paleozoic","Paleozoic,Pokemon",4041,181.9 kg,4,4,4
https://scrapeme.live/shop/Zekrom/,Zekrom,"£,135.00","Concealing itself in lightning clouds, it flies throughout the Unova region. It creates electricity in its tail.",253 in stock,"Deep Black,Teravolt,zekrom","Deep Black,Pokemon",8154,760.6 kg,9,9,9
https://scrapeme.live/shop/Reshiram/,Reshiram,"£,147.00","When Reshiram’s tail flares, the heat energy moves the atmosphere and changes the world’s weather.",235 in stock,"reshiram,Turboblaze,Vast White","Pokemon,Vast White",6531,727.5 kg,10,10,10
https://scrapeme.live/shop/Virizion/,Virizion,"£,156.00",Legends say this Pokémon confounded opponents with its swift movements.,161 in stock,"Grassland,Justified,virizion","Grassland,Pokemon",7907,440.9 kg,6,6,6
https://scrapeme.live/shop/Terrakion/,Terrakion,"£,87.00","Spoken of in legend, this Pokémon used its phenomenal power to destroy a castle in its effort to protect Pokémon.",136 in stock,"Cavern,Justified,terrakion","Cavern,Pokemon",1701,573.2 kg,6,6,6
https://scrapeme.live/shop/Cobalion/,Cobalion,"£,111.00",It has a body and heart of steel. It worked with its allies to punish people when they hurt Pokémon.,94 in stock,"cobalion,Iron Will,Justified","Iron Will,Pokemon",5798,551.2 kg,6,6,6
https://scrapeme.live/shop/Volcarona/,Volcarona,"£,94.00","When volcanic ash darkened the atmosphere, it is said that Volcarona’s fire provided a replacement for the sun.",57 in stock,"Flame Body,sun,volcarona","Pokemon,Sun",6817,101.4 kg,5,5,5
https://scrapeme.live/shop/Hydreigon/,Hydreigon,"£,86.00","It responds to movement by attacking. This scary, three-headed Pokémon devours everything in its path!",299 in stock,"Brutal,hydreigon,Levitate","Brutal,Pokemon",9310,352.7 kg,5,5,5
https://scrapeme.live/shop/Zweilous/,Zweilous,"£,199.00","After it has eaten up all the food in its territory, it moves to another area. Its two heads do not get along.",69 in stock,"Hostile,Hustle,zweilous","Hostile,Pokemon",6661,110.2 kg,4,4,4
https://scrapeme.live/shop/Gogoat/,Gogoat,"£,97.00",They inhabit mountainous regions. The leader of the herd is decided by a battle of clashing horns.,104 in stock,"gogoat,Mount,Sap Sipper","Mount,Pokemon",6039,200.6 kg,5,5,5
https://scrapeme.live/shop/Skiddo/,Skiddo,"£,129.00","If it has sunshine and water, it doesn’t need to eat, because it can generate energy from the leaves on its back.",271 in stock,"Mount,Sap Sipper,skiddo","Mount,Pokemon",5049,68.3 kg,2,2,2
https://scrapeme.live/shop/Florges/,Florges,"£,93.00","In times long past, governors of castles would invite Florges to create flower gardens to embellish the castle domains.",25 in stock,"florges,Flower Veil,Garden","Garden,Pokemon",9793,22 kg,3,3,3
