url,title,price,description,stock,tags,categories,sku,poids,longueur,largeur,hauteur
https://scrapeme.live/shop/Lunatone/,Lunatone,"£,177.00","Lunatone becomes active around the time of the full moon. Instead of walking, it moves by floating in midair. The Pokémon’s intimidating red eyes cause all those who see it to become transfixed with fear.",91 in stock,"Levitate,lunatone,Meteorite","Meteorite,Pokemon",5917,370.4 kg,3,3,3
https://scrapeme.live/shop/Seviper/,Seviper,"£,107.00",Seviper’s swordlike tail serves two purposes—it slashes foes and douses them with secreted poison. This Pokémon will not give up its long-running blood feud with Zangoose.,300 in stock,"Fang Snake,seviper,Shed Skin","Fang Snake,Pokemon",9903,115.7 kg,8,8,8
https://scrapeme.live/shop/Altaria/,Altaria,"£,104.00",Altaria sings in a gorgeous soprano. Its wings are like cotton clouds. This Pokémon catches updrafts with its buoyant wings and soars way up into the wild blue yonder.,136 in stock,"altaria,Humming,Natural Cure","Humming,Pokemon",9924,45.4 kg,3,3,3
https://scrapeme.live/shop/Swablu/,Swablu,"£,121.00","Swablu loves to make things clean. If it spots something dirty, it will wipe and polish it with its cottony wings. If its wings become dirty, this Pokémon finds a stream and showers itself.",169 in stock,"Cotton Bird,Natural Cure,swablu","Cotton Bird,Pokemon",3915,2.6 kg,1,1,1
https://scrapeme.live/shop/Cacturne/,Cacturne,"£,31.00","If a traveler is going through a desert in the thick of night, Cacturne will follow in a ragtag group. The Pokémon are biding their time, waiting for the traveler to tire and become incapable of moving.",204 in stock,"cacturne,Sand Veil,Scarecrow","Pokemon,Scarecrow",8491,170.6 kg,4,4,4
https://scrapeme.live/shop/Cacnea/,Cacnea,"£,105.00","The more arid and harsh the environment, the more pretty and fragrant a flower Cacnea grows. This Pokémon battles by wildly swinging its thorny arms.",31 in stock,"cacnea,Cactus,Sand Veil","Cactus,Pokemon",5000,113.1 kg,1,1,1
https://scrapeme.live/shop/Flygon/,Flygon,"£,174.00","Flygon whips up a sandstorm by flapping its wings. The wings create a series of notes that sound like singing. Because the “singing” is the only thing that can be heard in a sandstorm, this Pokémon is said to be the desert spirit.",42 in stock,"flygon,Levitate,Mystic","Mystic,Pokemon",4103,180.8 kg,6,6,6
https://scrapeme.live/shop/Vibrava/,Vibrava,"£,200.00","Vibrava’s wings have not yet completed the process of growing. Rather than flying long distances, they are more useful for generating ultrasonic waves by vibrating.",218 in stock,"Levitate,Vibration,vibrava","Pokemon,Vibration",9249,33.7 kg,3,3,3
https://scrapeme.live/shop/Trapinch/,Trapinch,"£,116.00",Trapinch is a patient hunter. It digs an inescapable pit in a desert and waits for its prey to come tumbling down. This Pokémon can go a whole week without access to any water.,269 in stock,"Ant Pit,Arena Trap,trapinch","Ant Pit,Pokemon",4740,33.1 kg,2,2,2
https://scrapeme.live/shop/Spinda/,Spinda,"£,149.00",No two Spinda are said to have identical spot patterns on their hides. This Pokémon moves in a curious manner as if it is stumbling in dizziness. Its lurching movements can cause the opponent to become confused.,156 in stock,"spinda,Spot Panda,Tangled Feet","Pokemon,Spot Panda",7350,11 kg,3,3,3
https://scrapeme.live/shop/Wynaut/,Wynaut,"£,168.00","Wynaut gather on moonlit nights to play by squeezing up against each other. By being squeezed, this Pokémon gains endurance and is trained to dole out powerful counterattacks.",155 in stock,"Bright,Shadow Tag,wynaut","Bright,Pokemon",9836,30.9 kg,2,2,2
https://scrapeme.live/shop/Absol/,Absol,"£,134.00","Absol has the ability to foretell the coming of natural disasters. It lives in a harsh, rugged mountain environment. This Pokémon very rarely ventures down from the mountains.",59 in stock,"absol,Disaster,Pressure","Disaster,Pokemon",3431,103.6 kg,3,3,3
https://scrapeme.live/shop/Chimecho/,Chimecho,"£,51.00","In high winds, Chimecho cries as it hangs from a tree branch or the eaves of a building using a suction cup on its head. This Pokémon plucks berries with its long tail and eats them.",43 in stock,"chimecho,Levitate,Wind Chime","Pokemon,Wind Chime",6688,2.2 kg,2,2,2
https://scrapeme.live/shop/Tropius/,Tropius,"£,196.00",Children of the southern tropics eat as snacks the fruit that grows in bunches around the neck of Tropius. This Pokémon flies by flapping the leaves on its back as if they were wings.,66 in stock,"Chlorophyll,fruit,tropius","Fruit,Pokemon",7266,220.5 kg,6,6,6
https://scrapeme.live/shop/Dusclops/,Dusclops,"£,39.00","Dusclops absorbs anything, however large the object may be. This Pokémon hypnotizes its foe by waving its hands in a macabre manner and by bringing its single eye to bear. The hypnotized foe is made to do Dusclops’s bidding.",82 in stock,"Beckon,dusclops,Pressure","Beckon,Pokemon",4994,67.5 kg,5,5,5
https://scrapeme.live/shop/Duskull/,Duskull,"£,139.00",Duskull wanders lost among the deep darkness of midnight. There is an oft-told admonishment given to misbehaving children that this Pokémon will spirit away bad children who earn scoldings from their mothers.,75 in stock,"duskull,Levitate,Requiem","Pokemon,Requiem",6627,33.1 kg,2,2,2
https://scrapeme.live/shop/Banette/,Banette,"£,104.00","A cursed energy permeated the stuffing of a discarded and forgotten plush doll, giving it new life as Banette. The Pokémon’s energy would escape if it were to ever open its mouth.",233 in stock,"banette,Insomnia,Marionette","Marionette,Pokemon",6213,27.6 kg,3,3,3
https://scrapeme.live/shop/Shuppet/,Shuppet,"£,174.00","Shuppet grows by feeding on dark emotions, such as vengefulness and envy, in the hearts of people. It roams through cities in search of grudges that taint people.",138 in stock,"Insomnia,Puppet,shuppet","Pokemon,Puppet",7348,5.1 kg,2,2,2
https://scrapeme.live/shop/Kecleon/,Kecleon,"£,100.00","Kecleon alters its body coloration to blend in with its surroundings, allowing it to sneak up on its prey unnoticed. Then it lashes out with its long, stretchy tongue to instantly ensnare the unsuspecting target.",53 in stock,"Color Change,Color Swap,kecleon","Color Swap,Pokemon",2351,48.5 kg,3,3,3
https://scrapeme.live/shop/Castform/,Castform,"£,119.00","Castform borrows the power of nature to transform itself into the guises of the sun, rain, and snow-clouds. This Pokémon’s feelings change with the weather.",131 in stock,"castform,Forecast,Weather","Pokemon,Weather",9535,1.8 kg,1,1,1
https://scrapeme.live/shop/Milotic/,Milotic,"£,152.00","Milotic live at the bottom of large lakes. When this Pokémon’s body glows a vivid pink, it releases a pulsing wave of energy that brings soothing calm to troubled hearts.",79 in stock,"Marvel Scale,milotic,Tender","Pokemon,Tender",4867,357.1 kg,20,20,20
https://scrapeme.live/shop/Feebas/,Feebas,"£,194.00","While Feebas’s body is in tatters, it has a hardy and tenacious life force that enables it to live anywhere. However, this Pokémon is also slow and dimwitted, making it an easy catch.",146 in stock,"feebas,Fish,Oblivious","Fish,Pokemon",6505,16.3 kg,2,2,2
https://scrapeme.live/shop/Armaldo/,Armaldo,"£,42.00","Armaldo is a Pokémon species that became extinct in prehistoric times. This Pokémon is said to have walked on its hind legs, which would have been more convenient for life on land.",78 in stock,"armaldo,Battle Armor,Plate","Plate,Pokemon",3328,150.4 kg,4,4,4
https://scrapeme.live/shop/Anorith/,Anorith,"£,64.00","Anorith is said to be a type of Pokémon predecessor, with eight wings at the sides of its body. This Pokémon swam in the primordial sea by undulating these eight wings.",222 in stock,"anorith,Battle Armor,Old Shrimp","Old Shrimp,Pokemon",2511,27.6 kg,2,2,2
https://scrapeme.live/shop/Cradily/,Cradily,"£,154.00","Cradily’s body serves as an anchor, preventing it from being washed away in rough seas. This Pokémon secretes a strong digestive fluid from its tentacles.",183 in stock,"Barnacle,cradily,Suction Cups","Barnacle,Pokemon",5809,133.2 kg,4,4,4
https://scrapeme.live/shop/Lileep/,Lileep,"£,87.00","Lileep is an ancient Pokémon that was regenerated from a fossil. It remains permanently anchored to a rock. From its immobile perch, this Pokémon intently scans for prey with its two eyes.",268 in stock,"lileep,Sea Lily,Suction Cups","Pokemon,Sea Lily",2965,52.5 kg,3,3,3
https://scrapeme.live/shop/Quagsire/,Quagsire,"£,37.00","Quagsire hunts for food by leaving its mouth wide open in water and waiting for its prey to blunder in unaware. Because the Pokémon does not move, it does not get very hungry.",292 in stock,"Damp,quagsire,Water Fish","Pokemon,Water Fish",2688,165.3 kg,4,4,4
https://scrapeme.live/shop/Metagross/,Metagross,"£,170.00","Metagross is the result of two Metang achieving fusion. When hunting, this Pokémon pins the prey to the ground under its massive body. It then eats the helpless victim using the large mouth on its stomach.",177 in stock,"Clear Body,Iron Leg,metagross","Iron Leg,Pokemon",8825,1212.5 kg,5,5,5
https://scrapeme.live/shop/Metang/,Metang,"£,78.00","When two Beldum fuse together, Metang is formed. The brains of the Beldum are joined by a magnetic nervous system. This Pokémon turns its arms to the rear for traveling at high speed.",227 in stock,"Clear Body,Iron Claw,metang","Iron Claw,Pokemon",6906,446.4 kg,3,3,3
https://scrapeme.live/shop/Beldum/,Beldum,"£,122.00","Beldum keeps itself floating by generating a magnetic force that repels earth’s natural magnetism. When it sleeps, this Pokémon anchors itself to a cliff using the hooks on its rear.",93 in stock,"beldum,Clear Body,Iron Ball","Iron Ball,Pokemon",3484,209.9 kg,2,2,2
https://scrapeme.live/shop/Salamence/,Salamence,"£,62.00","By evolving into Salamence, this Pokémon finally realizes its long-held dream of growing wings. To express its joy, it flies and wheels all over the sky while spouting flames from its mouth.",242 in stock,"Dragon,Intimidate,salamence","Dragon,Pokemon",7686,226.2 kg,4,4,4
https://scrapeme.live/shop/Shelgon/,Shelgon,"£,56.00","Covering Shelgon’s body are outgrowths much like bones. The shell is very hard and bounces off enemy attacks. When awaiting evolution, this Pokémon hides away in a cavern.",76 in stock,"Endurance,Rock Head,shelgon","Endurance,Pokemon",1384,243.6 kg,3,3,3
https://scrapeme.live/shop/Bagon/,Bagon,"£,34.00","Bagon harbors a never-ending dream of one day soaring high among the clouds. As if trying to dispel its frustration over its inability to fly, this Pokémon slams its hard head against huge rocks and shatters them into pebbles.",232 in stock,"bagon,Rock Head","Pokemon,Rock Head",3372,92.8 kg,2,2,2
https://scrapeme.live/shop/Luvdisc/,Luvdisc,"£,44.00",Luvdisc’s heart-shaped body is a symbol of love and romance. It is said that any couple meeting this Pokémon is promised a loving relationship that never ends.,190 in stock,"luvdisc,Rendezvous,Swift Swim","Pokemon,Rendezvous",4868,19.2 kg,2,2,2
https://scrapeme.live/shop/Relicanth/,Relicanth,"£,157.00",Relicanth is a rare species that was discovered in deep-sea explorations. This Pokémon’s body withstands the enormous water pressure of the ocean depths. Its body is covered in tough scales that are like craggy rocks.,14 in stock,"Longevity,relicanth,Rock Head","Longevity,Pokemon",7988,51.6 kg,3,3,3
https://scrapeme.live/shop/Gorebyss/,Gorebyss,"£,150.00","Although Gorebyss is the very picture of elegance and beauty while swimming, it is also cruel. When it spots prey, this Pokémon inserts its thin mouth into the prey’s body and drains the prey of its body fluids.",165 in stock,"gorebyss,South Sea,Swift Swim","Pokemon,South Sea",9428,49.8 kg,5,5,5
https://scrapeme.live/shop/Huntail/,Huntail,"£,52.00","Huntail’s tail is shaped like a fish. It uses the tail to attract prey, then swallows the prey whole with its large, gaping mouth. This Pokémon swims by wiggling its slender body like a snake.",54 in stock,"Deep Sea,huntail,Swift Swim","Deep Sea,Pokemon",2805,59.5 kg,5,5,5
https://scrapeme.live/shop/Clamperl/,Clamperl,"£,48.00","Clamperl grows while being protected by its rock-hard shell. When its body becomes too large to fit inside the shell, it is sure evidence that this Pokémon is getting close to evolution.",139 in stock,"Bivalve,clamperl,Shell Armor","Bivalve,Pokemon",2967,115.7 kg,1,1,1
https://scrapeme.live/shop/Walrein/,Walrein,"£,27.00","Walrein swims all over in frigid seawater while crushing icebergs with its grand, imposing tusks. Its thick layer of blubber makes enemy attacks bounce off harmlessly.",226 in stock,"Ice Break,Thick Fat,walrein","Ice Break,Pokemon",1600,332 kg,4,4,4
https://scrapeme.live/shop/Spheal/,Spheal,"£,193.00","Spheal always travels by rolling around on its ball-like body. When the season for ice floes arrives, this Pokémon can be seen rolling about on ice and crossing the sea.",170 in stock,"Clap,spheal,Thick Fat","Clap,Pokemon",7748,87.1 kg,2,2,2
https://scrapeme.live/shop/Sealeo/,Sealeo,"£,160.00","Sealeo often balances and rolls things on the tip of its nose. While the Pokémon is rolling something, it checks the object’s aroma and texture to determine whether it likes the object or not.",171 in stock,"Ball Roll,sealeo,Thick Fat","Ball Roll,Pokemon",4231,193.1 kg,3,3,3
https://scrapeme.live/shop/Glalie/,Glalie,"£,178.00","Glalie has the ability to freely control ice. For example, it can instantly freeze its prey solid. After immobilizing its prey in ice, this Pokémon enjoys eating it in leisurely fashion.",14 in stock,"Face,glalie,Inner Focus","Face,Pokemon",8582,565.5 kg,4,4,4
https://scrapeme.live/shop/Snorunt/,Snorunt,"£,82.00",Snorunt survives by eating only snow and ice. Old folklore claims that a house visited by this Pokémon is sure to prosper for many generations to come.,80 in stock,"Inner Focus,snorunt,Snow Hat","Pokemon,Snow Hat",1099,37 kg,2,2,2
https://scrapeme.live/shop/Prinplup/,Prinplup,"£,177.00",It lives a solitary life. Its wings deliver wicked blows that can snap even the thickest of trees.,52 in stock,"Penguin,prinplup,Torrent","Penguin,Pokemon",5785,50.7 kg,2,2,2
https://scrapeme.live/shop/Infernape/,Infernape,"£,165.00",It tosses its enemies around with agility. It uses all its limbs to fight in its own unique style.,82 in stock,"Blaze,Flame,infernape","Flame,Pokemon",3225,121.3 kg,3,3,3
https://scrapeme.live/shop/Monferno/,Monferno,"£,68.00",It uses ceilings and walls to launch aerial attacks. Its fiery tail is but one weapon.,299 in stock,"Blaze,monferno,Playful","Playful,Pokemon",8413,48.5 kg,2,2,2
https://scrapeme.live/shop/Chimchar/,Chimchar,"£,143.00",The gas made in its belly burns from its rear end. The fire burns weakly when it feels sick.,242 in stock,"Blaze,chimchar,Chimp","Chimp,Pokemon",5021,13.7 kg,1,1,1
https://scrapeme.live/shop/Torterra/,Torterra,"£,87.00",Small Pokémon occasionally gather on its unmoving back to begin building their nests.,146 in stock,"Continent,Overgrow,torterra","Continent,Pokemon",8373,683.4 kg,7,7,7
https://scrapeme.live/shop/Grotle/,Grotle,"£,154.00",It knows where pure water wells up. It carries fellow Pokémon there on its back.,187 in stock,"grotle,Grove,Overgrow","Grove,Pokemon",7359,213.8 kg,3,3,3
https://scrapeme.live/shop/Turtwig/,Turtwig,"£,101.00","It undertakes photosynthesis with its body, making oxygen. The leaf on its head wilts if it is thirsty.",254 in stock,"Overgrow,Tiny Leaf,turtwig","Pokemon,Tiny Leaf",8788,22.5 kg,1,1,1
https://scrapeme.live/shop/Jirachi/,Jirachi,"£,111.00",Jirachi will awaken from its sleep of a thousand years if you sing to it in a voice of purity. It is said to make true any wish that people desire.,294 in stock,"jirachi,Serene Grace,Wish","Pokemon,Wish",7952,2.4 kg,1,1,1
https://scrapeme.live/shop/Rayquaza/,Rayquaza,"£,97.00","It flies forever through the ozone layer, consuming meteoroids for sustenance. The many meteoroids in its body provide the energy it needs to Mega Evolve.",31 in stock,"Air Lock,rayquaza,Sky High","Pokemon,Sky High",5410,455.2 kg,23,23,23
https://scrapeme.live/shop/Kyogre/,Kyogre,"£,27.00","Kyogre is said to be the personification of the sea itself. Legends tell of its many clashes against Groudon, as each sought to gain the power of nature.",136 in stock,"Drizzle,kyogre,Sea Basin","Pokemon,Sea Basin",5206,776 kg,14,14,14
https://scrapeme.live/shop/Groudon/,Groudon,"£,124.00","Through Primal Reversion and with nature’s full power, it will take back its true form. It can cause magma to erupt and expand the landmass of the world.",138 in stock,"Continent,Drought,groudon","Continent,Pokemon",6626,2094.4 kg,11,11,11
https://scrapeme.live/shop/Latios/,Latios,"£,166.00",Latios will only open its heart to a Trainer with a compassionate spirit. This Pokémon can fly faster than a jet plane by folding its forelegs to minimize air resistance.,197 in stock,"Eon,latios,Levitate","Eon,Pokemon",7850,132.3 kg,6,6,6
https://scrapeme.live/shop/Latias/,Latias,"£,126.00",Latias is highly intelligent and capable of understanding human speech. It is covered with a glass-like down. The Pokémon enfolds its body with its down and refracts light to alter its appearance.,245 in stock,"Eon,latias,Levitate","Eon,Pokemon",5077,88.2 kg,4,4,4
https://scrapeme.live/shop/Registeel/,Registeel,"£,196.00",Registeel was imprisoned by people in ancient times. The metal composing its body is thought to be a curious substance that is not of this earth.,67 in stock,"Clear Body,Iron,registeel","Iron,Pokemon",6723,451.9 kg,6,6,6
https://scrapeme.live/shop/Regice/,Regice,"£,165.00","Regice cloaks itself with frigid air of -328 degrees Fahrenheit. Things will freeze solid just by going near this Pokémon. Its icy body is so cold, it will not melt even if it is immersed in magma.",107 in stock,"Clear Body,Iceberg,regice","Iceberg,Pokemon",2261,385.8 kg,5,5,5
https://scrapeme.live/shop/Regirock/,Regirock,"£,66.00","Regirock’s body is composed entirely of rocks. Recently, a study made the startling discovery that the rocks were all unearthed from different locations.",65 in stock,"Clear Body,regirock,Rock Peak","Pokemon,Rock Peak",5687,507.1 kg,5,5,5
https://scrapeme.live/shop/Shieldon/,Shieldon,"£,42.00",It was generated from a fossil dug out of a layer of clay that was older than anyone knows. It has a sturdy face.,284 in stock,"Shield,shieldon,Sturdy","Pokemon,Shield",9942,125.7 kg,1,1,1
https://scrapeme.live/shop/Rampardos/,Rampardos,"£,196.00",Its skull is as hard as iron. It is a brute that tears down jungle trees while catching prey.,91 in stock,"Head Butt,Mold Breaker,rampardos","Head Butt,Pokemon",3536,226 kg,5,5,5
https://scrapeme.live/shop/Cranidos/,Cranidos,"£,47.00","A lifelong jungle dweller from 100 million years ago, it would snap obstructing trees with headbutts.",98 in stock,"cranidos,Head Butt,Mold Breaker","Head Butt,Pokemon",8627,69.4 kg,2,2,2
https://scrapeme.live/shop/Roserade/,Roserade,"£,155.00","With the movements of a dancer, it strikes with whips that are densely lined with poison thorns.",116 in stock,"Bouquet,Poison Point,roserade","Bouquet,Pokemon",7696,32 kg,2,2,2
https://scrapeme.live/shop/Budew/,Budew,"£,171.00","Over the winter, it closes its bud and endures the cold. In spring, the bud opens and releases pollen.",62 in stock,"Bud,budew,Poison Point","Bud,Pokemon",3438,2.6 kg,,,
https://scrapeme.live/shop/Luxray/,Luxray,"£,43.00",Luxray’s ability to see through objects comes in handy when it’s scouting for danger.,227 in stock,"Gleam Eyes,Intimidate,luxray","Gleam Eyes,Pokemon",4317,92.6 kg,4,4,4
https://scrapeme.live/shop/Luxio/,Luxio,"£,168.00",Strong electricity courses through the tips of its sharp claws. A light scratch causes fainting in foes.,222 in stock,"Intimidate,luxio,Spark","Pokemon,Spark",9734,67.2 kg,2,2,2
https://scrapeme.live/shop/Shinx/,Shinx,"£,149.00",All of its fur dazzles if danger is sensed. It flees while the foe is momentarily blinded.,295 in stock,"Flash,Intimidate,shinx","Flash,Pokemon",1507,20.9 kg,1,1,1
https://scrapeme.live/shop/Kricketune/,Kricketune,"£,53.00",It signals its emotions with its melodies. Scientists are studying these melodic patterns.,186 in stock,"Cricket,kricketune,Swarm","Cricket,Pokemon",8726,56.2 kg,3,3,3
https://scrapeme.live/shop/Kricketot/,Kricketot,"£,94.00","When its antennae hit each other, it sounds like the music of a xylophone.",137 in stock,"Cricket,kricketot,Shed Skin","Cricket,Pokemon",9812,4.9 kg,1,1,1
https://scrapeme.live/shop/Bibarel/,Bibarel,"£,114.00",It makes its nest by damming streams with bark and mud. It is known as an industrious worker.,156 in stock,"Beaver,bibarel,Simple","Beaver,Pokemon",6844,69.4 kg,3,3,3
https://scrapeme.live/shop/Bidoof/,Bidoof,"£,128.00",It constantly gnaws on logs and rocks to whittle down its front teeth. It nests alongside water.,264 in stock,"bidoof,Plump Mouse,Simple","Plump Mouse,Pokemon",1171,44.1 kg,1,1,1
https://scrapeme.live/shop/Staraptor/,Staraptor,"£,42.00","When Staravia evolve into Staraptor, they leave the flock to live alone. They have sturdy wings.",131 in stock,"Intimidate,Predator,staraptor","Pokemon,Predator",9866,54.9 kg,3,3,3
https://scrapeme.live/shop/Staravia/,Staravia,"£,158.00",It lives in forests and fields. Squabbles over territory occur when flocks collide.,263 in stock,"Intimidate,staravia,Starling","Pokemon,Starling",1799,34.2 kg,2,2,2
https://scrapeme.live/shop/Starly/,Starly,"£,59.00","They flock around mountains and fields, chasing after bug Pokémon. Their singing is noisy and annoying.",110 in stock,"Keen Eye,Starling,starly","Pokemon,Starling",3055,4.4 kg,1,1,1
https://scrapeme.live/shop/Empoleon/,Empoleon,"£,42.00",The three horns that extend from its beak attest to its power. The leader has the biggest horns.,232 in stock,"Emperor,empoleon,Torrent","Emperor,Pokemon",2449,186.3 kg,5,5,5
https://scrapeme.live/shop/Buneary/,Buneary,"£,180.00","When it senses danger, it perks up its ears. On cold nights, it sleeps with its head tucked into its fur.",204 in stock,"buneary,Rabbit,Run Away","Pokemon,Rabbit",6054,12.1 kg,1,1,1
https://scrapeme.live/shop/Drifblim/,Drifblim,"£,36.00","It’s drowsy in daytime, but flies off in the evening in big groups. No one knows where they go.",233 in stock,"Aftermath,Blimp,drifblim","Blimp,Pokemon",9301,33.1 kg,3,3,3
https://scrapeme.live/shop/Drifloon/,Drifloon,"£,70.00",These Pokémon are called the “Signpost for Wandering Spirits.” Children holding them sometimes vanish.,84 in stock,"Aftermath,Balloon,drifloon","Balloon,Pokemon",6748,2.6 kg,1,1,1
https://scrapeme.live/shop/Ambipom/,Ambipom,"£,36.00","To eat, it deftly shucks nuts with its two tails. It rarely uses its arms now.",247 in stock,"ambipom,Long Tail,Pickup","Long Tail,Pokemon",9199,44.8 kg,3,3,3
https://scrapeme.live/shop/Gastrodon/,Gastrodon,"£,148.00",It apparently had a huge shell for protection in ancient times. It lives in shallow tidal pools.,119 in stock,"gastrodon,Sea Slug,Sticky Hold","Pokemon,Sea Slug",8490,65.9 kg,2,2,2
https://scrapeme.live/shop/Shellos/,Shellos,"£,163.00","Its shape and coloration vary, depending on its habitat.",149 in stock,"Sea Slug,shellos,Sticky Hold","Pokemon,Sea Slug",4538,13.9 kg,1,1,1
https://scrapeme.live/shop/Cherrim/,Cherrim,"£,161.00","If it senses strong sunlight, it opens its folded petals to absorb the sun’s rays with its whole body.",143 in stock,"Blossom,cherrim,Flower Gift","Blossom,Pokemon",2914,20.5 kg,1,1,1
https://scrapeme.live/shop/Cherubi/,Cherubi,"£,101.00",It evolves by sucking the energy out of the small ball where it had been storing nutrients.,127 in stock,"Cherry,cherubi,Chlorophyll","Cherry,Pokemon",5681,7.3 kg,1,1,1
https://scrapeme.live/shop/Floatzel/,Floatzel,"£,40.00",Its flotation sac developed as a result of pursuing aquatic prey. It can double as a rubber raft.,116 in stock,"floatzel,Sea Weasel,Swift Swim","Pokemon,Sea Weasel",4591,73.9 kg,3,3,3
https://scrapeme.live/shop/Buizel/,Buizel,"£,55.00",It inflates the flotation sac around its neck and pokes its head out of the water to see what is going on.,62 in stock,"buizel,Sea Weasel,Swift Swim","Pokemon,Sea Weasel",9044,65 kg,2,2,2
https://scrapeme.live/shop/Pachirisu/,Pachirisu,"£,151.00",A pair may be seen rubbing their cheek pouches together in an effort to share stored electricity.,86 in stock,"EleSquirrel,pachirisu,Run Away","EleSquirrel,Pokemon",2264,8.6 kg,1,1,1
https://scrapeme.live/shop/Vespiquen/,Vespiquen,"£,104.00",Its abdomen is a honeycomb for grubs. It raises its grubs on honey collected by Combee.,123 in stock,"Beehive,Pressure,vespiquen","Beehive,Pokemon",1078,84.9 kg,3,3,3
https://scrapeme.live/shop/Combee/,Combee,"£,111.00","It collects and delivers honey to its colony. At night, they cluster to form a beehive and sleep.",254 in stock,"combee,Honey Gather,Tiny Bee","Pokemon,Tiny Bee",7856,12.1 kg,1,1,1
https://scrapeme.live/shop/Mothim/,Mothim,"£,177.00",It flutters around at night and steals honey from the Combee hive.,151 in stock,"Moth,mothim,Swarm","Moth,Pokemon",2443,51.4 kg,2,2,2
https://scrapeme.live/shop/Burmy/,Burmy,"£,91.00","If its cloak is broken in battle, it quickly remakes the cloak with materials nearby.",266 in stock,"Bagworm,burmy,Shed Skin","Bagworm,Pokemon",6129,7.5 kg,,,
https://scrapeme.live/shop/Bastiodon/,Bastiodon,"£,191.00",Any frontal attack is repulsed. It is a docile Pokémon that feeds on grass and berries.,14 in stock,"bastiodon,Shield,Sturdy","Pokemon,Shield",6537,329.6 kg,4,4,4
https://scrapeme.live/shop/Garchomp/,Garchomp,"£,62.00",It flies at speeds equal to a jet fighter plane. It never allows its prey to escape.,65 in stock,"garchomp,Mach,Sand Veil","Mach,Pokemon",8222,209.4 kg,6,6,6
